Year,State,Type,Number,Companion,URL,Status,Description,Author/Sponsor,Level,Open Mentioned,Enacted2015,Massachusetts,Legislation,S 675,,https://malegislature.gov/Bills/189/Senate/S675,In Higher Education Committee (S); Hearing scheduled for 6/3; Continued to 2016; Died,"An Act Relative to Open Textbooks: This bill creates the Massachusetts Open Source Digital Library, the purpose of which is to house open source materials and provide internet based ways for students, faculty, and staff to easily find, adopt, utilize or modify course materials at little or no cost",Michael Moore,Higher Ed,yes,no2015,New Jersey,Legislation,A 2809,S 2348,https://legiscan.com/NJ/bill/A2809/2014,Introduced and referred to Assembly Higher Education Committee 3/24/14,"Affordable College Textbook Act: This bill requires that within 180 days of the Act becoming effective, 4 year public or indendpent institutions of higher education, after consultation with faculty members, shall submit a plan to the Secretary of Higher Education to expand the use of open textbooks in order to achieve savings for students enrolled. This bill recognizes that open educational resources are important because they can be used freely by students, faculty, and the general public and can be used in place of traditional textbook materials, which can reduce textbook costs by 80-100%","Joseph Cryan, Celeste Riley, Annette Quijano, Nancy Pinkin, Paul Moriarty, Jamel Holley, Angel Fuentes, Carmelo Garcia",Higher Ed,yes,no2015,New Jersey,Legislation,S 2348,A 2809,https://legiscan.com/NJ/bill/S2348/2014,Introduced and referred to Senate Higher Education Committee 8/18/2014,"Affordable College Textbook Act: This bill requires that within 180 days of the Act becoming effective, 4 year public or indendpent institutions of higher education, after consultation with faculty members, shall submit a plan to the Secretary of Higher Education to expand the use of open textbooks in order to achieve savings for students enrolled. This bill recognizes that open educational resources are important because they can be used freely by students, faculty, and the general public and can be used in place of traditional textbook materials, which can reduce textbook costs by 80-100%",Shirley Turner,Higher Ed,yes,no2015,New York,Legislation,A 6377,,http://assembly.state.ny.us/leg/?bn=A06377&term=2015,Referred to Higher Education Committee 3/20,"This bill creates a task force to review the cost of textbooks, with a goal of finding ways to make materials more affordable through ways such as: open access textbooks and digital textbooks. The task force's report must be submitted by January 1, 2016 and it must include ways to promote the greater development, adoption, deployment, and use of open access textbooks in both digital and print formats for students and faculty in fiscally sustainable ways.",Chad Lupinacci,Higher Ed,yes,no2015,North Carolina,Legislation,HB 660,,http://www.ncleg.net/gascripts/BillLookUp/BillLookUp.pl?Session=2015&BillID=h660,Passed third reading in House 4/29; Passed first reading in Senate 4/30; Referred to Committee on Rules and Operations of the Senate; Died,Transition to Personalized Digital Learning: This bill requires the State Board to provide access to digital learning resources for all K-12 public schools. This access must include access to open educational resources that are developed in North Carolina and elsewhere,"Craig Horn, Jason Saine, Charles Jeter, John Fraley",K-12,yes,no2015,North Dakota,Legislation,HB 1261,,http://www.legis.nd.gov/assembly/64-2015/bill-index/bi1261.html,Dead - failed to pass second reading in House,"A Bill for an Act to Create a Higher Education Open Educational Resources Incentive Grant Program: This bill creates a higher education open educational resources incentive grant program. The grants may be awarded to academic faculty and instructional staff at institutions for salary performance bonuses or equipment and resources for the development and implementation of open educational resources","Thomas Beadle, Kathy Hawken, Tom Kading, Gary Nelson, Kylie Oversen, Mark Sanford",Higher Ed,yes,no2015,Oregon,Legislation,HB 2871,,https://olis.leg.state.or.us/liz/2015R1/Measures/Overview/HB2871,Signed and Enacted (Chapter 727),"Establishes Open Educational Resources Grant Program within Higher Education Coordinating Commission: This Act was created to encourage the use of low or no-cost open educational resources in post-secondary institutions of education. This act allows the commission to award grants to applicants who adapt or make use of existing open educational resources and utilizes students in the design or production of open educational resource materials. Finally, this Act also employs an open educational resource specialist who fosters the use of open                 educational resources in colleges and universities","Higher Education, Innovation, and Workforce Development ",Higher Ed,yes,yes2015,Tennessee,Legislation,HB 60,SB 61,http://wapp.capitol.tn.gov/apps/BillInfo/Default.aspx?BillNumber=HB0060&ga=109,Dead,"Textbooks: This bill creates a study committee to make recommendations on the transition from traditional textbooks to free, online textbooks and course materials by the public higher education institutions. This committee will review the impact of open textbooks and course materials on the cost of traditional textbooks, the extent to which open textbooks and course materials can be used at institutions of higher education, and the possible savings generated for students and the state through the use of open textbooks and course materials","Mark Green, Mike Sparks",Higher Ed,yes,no2015,Tennessee,Legislation,SB 61,HB 60,http://wapp.capitol.tn.gov/apps/BillInfo/Default.aspx?BillNumber=SB0061&ga=109,Dead,"Textbooks: This bill creates a study committee to make recommendations on the transition from traditional textbooks to free, online textbooks and course materials by the public higher education institutions. This committee will review the impact of open textbooks and course materials on the cost of traditional textbooks, the extent to which open textbooks and course materials can be used at institutions of higher education, and the possible savings generated for students and the state through the use of open textbooks and course materials","Mark Green, Mike Sparks",Higher Ed,yes,no2015,Texas,Legislation,SB 915,,http://www.capitol.state.tx.us/BillLookup/History.aspx?LegSess=84R&Bill=SB915,House Committee Report Sent to Calendars 5/18 - Dead,"An Act relating to the Establishment and Administration by the Texas Higher Education Coordinating Board of a Textbook Affordability Pilot Program at a Public Institution of Higher Education: This bill requires the board to establish and administer a pilot program to encourage the use of affordable textbooks at institutions of higher education. One eligible institution will participate in this pilot program. The academic department that participates is required to use electronic or open-source textbooks, open educational resources, public domain material, or other free or low-cost textbooks or textbook alternatives for each course offered through the department, to the greatest extent possible.","Lois Kolkhorst, John Zerwas",Higher Ed,yes,no2015,Virginia,Legislation,HB 2041,,http://lis.virginia.gov/cgi-bin/legp604.exe?ses=151&typ=bil&val=hb2041&submit=GO,Left in House Appropriations - Dead,"A Bill to Amend the Code of Virginia relating to the Establishment of the Open Education Resources Innovation Council: The Open Education Resources Innovation Council is established for the purpose of identifying open education resources at all levels of education and uses for such resources and recommending specific policies and funding mechanisms for the increased use of open education resources in the Commonwealth. This Council is required to advise the Governor and General Assembly on open education policies that have the potential to reduce the cost of textbooks and educational materials in the Commonwealth while maintaining or adding value to the learning experience, and developing and maintaining a list of 50 digital open source textbooks, amongst other duties.",Eileen Filler-Corn,Both,yes,no2015,Washington,Legislation,HB 1973,,http://app.leg.wa.gov/billinfo/summary.aspx?bill=1973&year=2015,"By resolution, reintroduced and retained in present status - Dead","An Act Relating to the Washington Open Education Pilot Program at Eastern Washington University: This bill establishes the Eastern Washington University open education pilot program, created to reduce student’s cost of attendance by creating an open educational resources program","Stambaugh, Bergquist, Hargrove, Haler, Zeiger, Van Werven, Magendanz, Kochmar, Muri, Gregerson, Parker, Riccelli",Higher Ed,yes,no2015,Washington,Legislation,HB 2165,,http://app.leg.wa.gov/billsummary?BillNumber=2165&Year=2015,"By resolution, reintroduced and retained in present status - Dead","An Act Eliminating the use of Common Core State Standards and Assessments: This bill requires the superintendent of public instruction to identify and develop a library of openly licensed courseware aligned with the state standards - this would allow others to use, distribute, and create derivative works based upon the digital material, while still allowing the authors or creators to retain the copyright and to receive credit for their efforts. The open educational resources account will be created in the custody of the state treasurer.","Scott, Haler, Shea, Vick, Short, Van Werven, Condotta, Wilson, Young, Orcutt, Kochmar, Schmick, Taylor, Harmsworth, Hunt, G., Griffey, Klippert, Buys, Parker, Holy, Pike, MacEwen",K-12,yes,no