Year,State,Type,Number,Companion,URL,Status,Description,Author/Sponsor,Level,Open Mentioned,Enacted2016,New Jersey,Legislation,A 2653,S 2619,http://www.njleg.state.nj.us/bills/BillView.asp?BillNumber=A2653,Introduced and referred to Assembly Higher Education Committee 2/8/16; For Preliminary Committee Action - to be reported preliminary - to be reported SCA - 10/17/16,"An Act Concerning College Textbooks: This requires institutions of higher education to develop open textbooks available to students at no charge. Within 180 days of the effective date of this act, higher education institutes are required to submit a plan to the Secretary of Higher Education to expand the use of open textbooks in order to achieve savings for students enrolled in the institution.","Nancy Pinkin, Mila Jasey, Wayne DeAngelo, Joe Danielson",Higher Ed,yes,no2016,New Jersey,Legislation,S 2619,A 2653,http://www.njleg.state.nj.us/bills/BillView.asp?BillNumber=S2619,Passed the Senate (37-0) - 12/19/16; Received in the Assembly and referred to Assembly Higher Education Committee ,"An Act Concerning College Textbooks: This requires institutions of higher education to develop open textbooks available to students at no charge. Within 180 days of the effective date of this act, higher education institutes are required to submit a plan, created in consultation with faculty members at the institution, to the Secretary of Higher Education to expand the use of open textbooks in order to achieve savings for students enrolled in the institution.","Sandra B. Cunningham, Nilsa Cruz-Perez",Higher Ed,yes,no2016,New York,Legislation,A 6377,,http://assembly.state.ny.us/leg/?bn=A06377&term=2015,Referred to Higher Education Committee 1/6/16,"This bill creates a task force to review the cost of textbooks, with a goal of finding ways to make materials more affordable through ways such as: open access textbooks and digital textbooks. The task force's report must be submitted by January 1, 2016 and it must include ways to promote the greater development, adoption, deployment, and use of open access textbooks in both digital and print formats for students and faculty in fiscally sustainable ways.",Chad Lupinacci,Higher Ed,yes,no2016,New York,Legislation,S 7508,,http://nyassembly.gov/leg/?default_fld=&leg_video=&bn=S07508&term=2015&Summary=Y&Actions=Y,Introduced and referred to Higher Education Committee - 5/6/16,"This bill requires the boards of trustees of the state university of New York and the city university of New York each to conduct and report on the availability and accessibility of alternative high-quality, lower cost course resources in lieu of traditional textbooks - this may include OER, online textbooks, and other related educational materials",Hamilton,Higher Ed,yes,no2016,North Carolina,Legislation,HB 660,,http://www.ncleg.net/gascripts/BillLookUp/BillLookUp.pl?Session=2015&BillID=H660&submitButton=Go,Passed House - 4/29/15; Passed first reading in Senate - 4/30/15; Referred to Committee on Rules and Operations of the Senate - 4/30/15,Transition to Personalized Digital Learning: This bill requires the State Board to provide access to digital learning resources for all K-12 public schools. This access must include access to open educational resources that are developed in North Carolina and elsewhere,"Craig Horn, Jason Saine, Charles Jeter, John Fraley",K-12,yes,no2016,North Dakota,Legislation,HB 1261,,http://www.legis.nd.gov/assembly/64-2015/documents/15-0492-02000.pdf,Dead - failed to pass second reading in House,A Bill for an Act to Create a Higher Education Open Educational Resources Incentive Grant Program: This bill creates a higher education open educational resources incentive grant program. The grants may be awarded to academic faculty and instructional staff at institutions for salary performance bonuses or equipment and resources for the development and implementation of open educational resources,"Thomas Beadle, Kathy Hawken, Tom Kading, Jon Nelson, Kylie Oversen, Mark Sanford, Ray Holmberg, Karen Krebsbach",Higher Ed,yes,no2016,Oregon,Rule,OAR-581-011-0080,,http://www.ode.state.or.us/superintendent/priorities/7.e_1-oar-581-011-0080-revision-with-track-changes.pdf,Adopted by Oregon Department of Education,"OAR-581-011-0080-revision: (3) The State Board authorizes the Department of Education to collect a bond or an irrevocable letter of credit up to $10,000. The Department may collect a lower bond amount when the following conditions are met: (a) the materials under contract are Open Educational Resources and (b) are submitted for review in their free ($0 cost to obtain content) format. Open Educational Resources (OER) are defined as teaching and learning resources that reside in the public domain or have been released under an open license that permits their free use and re-purposing by others.",Vanessa Clark ,K-12,yes,yes2016,Pennsylvania,Legislation,HB 1578,,http://www.legis.state.pa.us/cfdocs/billinfo/bill_history.cfm?syear=2015&sind=0&body=H&type=B&bn=1578,Introduced in 2015; Amended - 6/13/16; Third consideration and final passage in House - 6/20/16; Referred to Senate Education Committee - 6/23/16,"E-chievement Program: Grants will be awarded to schools for hybrid learning, including digital instructional content, classroom management tools, operations support, technology and equipment, professional development, instructional coaching, consulting services, and planning assistance. Hybrid learning is defined as an instructional strategy that blends digital resources with classroom teaching. ","Fee, Bloom, R. Brown, Carroll, Causer, Cohen, Cutler, Davis, Diamond, Farry, Gibbons, Gingrich, Greiner, Grove, Hickernell, Kaufer, Killion, Mentzer, Miccarelli, Millard, B. Miller, Pickett, Rozzi, Saylor, Ward, Watson, Zimmerman, Santora, Schlegel, Culver, and MacKenzie",K-12,no,no2016,Pennsylvania,Legislation,HB 2389,,http://www.legis.state.pa.us/cfdocs/billinfo/billinfo.cfm?syear=2015&sind=0&body=H&type=B&bn=2389,Introduced and referred to Education Committee - 10/4/16,"An Act providing for availability of electronic textbooks at institutions of higher education: This bill would require that any entity that publishes textbooks offered for sale at an institution of higher education shall, to the extent practicable, make the textbooks available for sale in electronic format.  ","Matzie, Nesbit, Readshaw, Kortz, D. Costa, Dunbar, Topper, Reese, Conklin, W. Keller, Rozzi, McClinton, Neilson, Petri",Higher Ed,no,no2016,Pennsylvania,Legislation,SB 924,,http://www.legis.state.pa.us/cfdocs/billinfo/billinfo.cfm?syear=2015&sind=0&body=S&type=B&bn=0924,Introduced and referred to Education - 6/24/15,"E-chievement Program: Grants will be awarded to schools for hybrid learning, including digital instructional content, classroom management tools, operations support, technology and equipment, professional development, instructional coaching, consulting services, and planning assistance. Hybrid learning is defined as an instructional strategy that blends digital resources with classroom teaching. ","Aument, Scarnati, Rafferty, Alloway, Black, Gordner, Baker, Yudichak, Schwank, Argall, Mensch, Dinniman, Browne, Scavello, Stefano, Haywood",K-12,no,no2016,South Carolina,Legislation,S 528,,http://www.scstatehouse.gov/query.php?search=DOC&searchtext=textbook&category=LEGISLATION&session=121&conid=8117264&result_pos=0&keyval=1210528&numrows=10,Senate Committee Report - Majority favorable with amendment; minority unfavorable Education - 3/26/15; Recommitted to Education Committee - 5/31/16,"This bill would provide a textbook policy for public institutions of higher education that is intended to help minimize college textbook costs. Institutions or affilitated bookstores are required to provide students with practical advise about purchasing textbooks, including whether electronic versions are available","Nikki Setzler, Harvey Peeler, Kevin Bryant",Higher Ed,no,no2016,Tennessee,Legislation,HB 1058,SB 614,http://wapp.capitol.tn.gov/apps/BillInfo/Default.aspx?BillNumber=SB0614,Taken off notice for calendar in Education Instruction & Programs Subcommittee - 3/18/15; Sponsor added - 2/18/16,This bill requires a local board that chooses to furnish electronic textbooks and instructional materials to pupils attending school to also provide the public with reasonable access to view the electronic textbooks and instructional materials. ,James Van Huss,K-12,no,no2016,Tennessee,Legislation,HB 2517,SB 2513,http://www.capitol.tn.gov/Bills/109/Bill/HB2517.pdf,Taken off notice for calendar in Education Administration and Planning Subcommittee of Education Administration and Planning - 3/15/16,Textbooks: Allows LEA's to use funds obtained by selling unusable or replaced textbooks for technology in addition to textbooks and instructional materials,Susan Lynn ,K-12,no,no2016,Tennessee,Legislation,HB 2598,SB 2160,http://www.capitol.tn.gov/Bills/109/Bill/HB2598.pdf,Assigned to Education Administration & Planning Subcommittee - 1/27/16; Taken off notice for calendar in subcommittee - 3/1/16,"This bill states the board of regents shall not approve mandatory textbook fees for institutions operated by the board whereby a student's textbooks, either physical or digital, are supplied for a course or courses. A student shall always have complete choice concerning from whom and whether the student acquires the textbooks for the courses in which the student is enrolled.",Mike Sparks    ,Higher Ed,no,no2016,Tennessee,Legislation,SB 2160,HB 2598,http://wapp.capitol.tn.gov/apps/BillInfo/Default.aspx?BillNumber=HB2598,Assigned to General Subcommittee of Senate Education Committee - 3/16/16,"This bill states the board of regents shall not approve mandatory textbook fees for institutions operated by the board whereby a student's textbooks, either physical or digital, are supplied for a course or courses. A student shall always have complete choice concerning from whom and whether the student acquires the textbooks for the courses in which the student is enrolled.",Reginald Tate,Higher Ed,no,no2016,Tennessee,Legislation,SB 2513,HB 2517,http://wapp.capitol.tn.gov/apps/BillInfo/Default.aspx?BillNumber=SB2513&GA=109,Assigned to General Subcommittee of Senate Education Committee - 3/16/16,Textbooks: Allows LEA's to use funds obtained by selling unusable or replaced textbooks for technology in addition to textbooks and instructional materials,Dolores Gresham,K-12,no,no2016,Tennessee,Legislation,SB 61,,http://wapp.capitol.tn.gov/apps/BillInfo/Default.aspx?BillNumber=SB0061,Assigned to General Subcommittee of Senate Education Committee - 4/1/15,"Textbooks: This bill creates a study committee to make recommendations on the transition from traditional textbooks to free, online textbooks and course materials by the public higher education institutions. This committee will review the impact of open textbooks and course materials on the cost of traditional textbooks, the extent to which open textbooks and course materials can be used at institutions of higher education, and the possible savings generated for students and the state through the use of open textbooks and course materials","Mike Sparks (HB60), Mark Green (SB61)",Higher Ed,yes,no2016,Tennessee,Legislation,SB 614,HB 1058,http://wapp.capitol.tn.gov/apps/BillInfo/Default.aspx?BillNumber=SB0614,Passed on Second Consideration - referred to Senate Education Committee - 2/12/15,This bill requires a local board that chooses to furnish electronic textbooks and instructional materials to pupils attending school to also provide the public with reasonable access to view the electronic textbooks and instructional materials. ,Joey Hensley,K-12,no,no2016,Virginia,Legislation,HB 662,,http://lis.virginia.gov/cgi-bin/legp604.exe?161+sum+HB662,Left in House Education Committee - 2/16/16,State Council of Higher Education for Virginia: Open Educational Resources. Requires the State Council of Higher Education to administer an Open Educational Resources Fund and Program to provide grants on a competitive basis to public institutions of higher education to encourage such institutions to use low-cost or no-cost open educational resources that are openly licensed and shared with the public through an existing or new open educational resources repository.,Eileen Filler-Corn,Higher Ed,yes,no2016,Virginia,Legislation,SB 740,,http://lis.virginia.gov/cgi-bin/legp604.exe?161+sum+SB740,Passed by indefinitely in Education by voice vote - 3/2/16,"Access to Electronic Textbooks: prohibits school boards requiring the use of any electronic textbook in any course in grades 6-12, unless the school board adopts a plan that each student in the course will have access to a personal computing device. The local school board may also establish a pilot program for the use of electronic textbooks at any secondaary school provided that each student within that school has access to a personal computing device capable of supporting such textbooks",Scott Surovell,K-12,no,no2016,Washington,Legislation,HB 1958,,http://app.leg.wa.gov/billinfo/summary.aspx?bill=1958&year=2015,"By resolution, reintroduced and retained in present status - 3/10/16 (Higher Education committee - 2/4/15)",This Act would prohibit institutions of higher education from assigning a student to purchase a textbook that costs more than $100 unless there is no available and comparable alternative that costs less and there is no available substitute through open course materials,"Hans Zeiger, Gerry Pollet, Larry Haler, Melanie Stambaugh, Mark Hargrove, Chad Magendanz, Vincent Buys, Steve Bergquist",Higher Ed,yes,no2016,Washington,Legislation,HB 1973,,http://app.leg.wa.gov/billinfo/summary.aspx?bill=1973&year=2015,"By resolution, reintroduced and retained in present status - 3/10/16 (referred to Appropriations - 2/2/15)","An Act Relating to the Washington Open Education Pilot Program at Eastern Washington University. This bill establishes the Eastern Washington University open education pilot program, created to reduce student’s cost of attendance by creating an open educational resources program","Melanie Stambaugh, Steve Bergquist, Mark Hargrove, Larry Haler, Hans Zeiger, Luanne Van Werven, Chad Magendanz, Linda Kochmar, Dick Muri, Mia Gergerson, Kevin Parker, Marcua Riccelli ",Higher Ed,yes,no2016,Washington,Legislation,HB 2165,,http://app.leg.wa.gov/billinfo/summary.aspx?bill=2165&year=2016,"By resolution, reintroduced and retained in present status - 3/10/16 (referred to Education - 2/2/15)","An Act Eliminating the use of Common Core State Standards and Assessments. This bill requires the superintendent of public instruction to identify and develop a library of openly licensed courseware aligned with the state standards - this would allow others to use, distribute, and create derivative works based upon the digital material, while still allowing the authors or creators to retain the copyright and to receive credit for their efforts. The open educational resources account will be created in the custody of the state treasurer.","Elizabeth Scott, Larry Haler, Matt Shea, Brandon Vick, Shelly Short, Luanne Van Werven, Cary Condotta, Lynda Wilson, Jesse Young, Ed Orcutt, Linda Kochmar, Joe Schmick, David Taylor, Mark Harmsworth, G. Hunt, Dan Griffey, Brad Klippert, Vincent Buys, Kevin Parker, Jeff Holy, Liz Pike, Drew MacEwen",K-12,yes,no2016,Washington,Legislation,HB 2680,,http://app.leg.wa.gov/billsummary?BillNumber=2680&Year=2015,"By resolution, reintroduced and retained in present status - 3/10/16 (Referred to appropriations - 2/5/16)","Creates the Washington open education pilot grant program within the student achievement council to create a competitive grant program to provide an incentive for faculty to adopt open educational resources and reduce students' costs of attendance.Requires the student achievement council to award up to one hundred grants per year to faculty members to develop or obtain open educational materials and resources. Expires June 30, 2019.","Melanie Stambaugh, Noel Frame, Hans Zeiger, Marcus Riccelli, Luanne Van Werven, Chad Magendanz, Linda Kochmar, Christine Kilduff, Mark Hargrove, Derek Stanford, Norm Johnson, Teri Hickel",Higher Ed,yes,no2016,Washington,Legislation,HB 2686,,http://app.leg.wa.gov/billinfo/summary.aspx?bill=2686&year=2016,"By resolution, reintroduced and retained in present status - 3/10/16 (referred to Appropriations - 2/5/16)","An Act Relating to making the Cost of Textbooks and Other College Course Materials More Affordable. By fall 2016, community and technical colleges are required to revise their college catalogs to identify which courses qualify as having open educational resources. Further, the college board must administer a grant program to promote expansion of the open course library. Finally, the college board shall administer a grant program to support colleges that develop a degree or certificate program composed of courses that have open educational resources.","Pat Sullivan, Brady Walkinshaw, Steve Bergquist, Christine Kilduff, JD Rossetti, Liz Pike, Hans Zeiger, Derek Stanford, Chad Magendanz, Jessyn Farrell, Sharon Santos, Timm Ormsby, Gerry Pollet",Higher Ed,yes,no2016,Washington,Legislation,HB 2780,,http://app.leg.wa.gov/billinfo/summary.aspx?bill=2780&year=2015,"By resolution, reintroduced and retained in present status - 3/10/16 (referred to Finance - 2/1/16)","Establishes the textbook affordability via open sourcing act. Provides a business and occupation tax credit and a public utility tax credit for a person that provides open source instructional material, at no cost, to a private or public institution of higher education that is used in lieu of other instructional materials for any course of study offered at the institution.","Jesse Young, Steve Bergquist, Melanie Stambaugh, Christine Kilduff, Mark Hargrove, Hans Zeiger, Teri Hickel ",Higher Ed,yes,no2016,West Virginia,Legislation,HB 4445,,http://www.wvlegislature.gov/Bill_Text_HTML/2016_SESSIONS/RS/Bills/hb4445%20intr.htm,Passed House - 2/22/16; Introduced in Senate and sent to Education Committee - 2/23/16,"Each county board is required to furnish, free of charge, the necessary instructional resources for students in public schools. If a county board chooses to furnish electronic instructional resources to students, then the board is required to provide reasonable access to the electronic resources and necessary computer equipment required to complete the homework assignments. ",Roger Hanshaw ,K-12,no,no2016,West Virginia,Legislation,HB 4627,,http://www.wvlegislature.gov/Bill_Text_HTML/2016_SESSIONS/RS/Bills/hb4627%20intr.htm,Introduced and referred to Education Committee - 2/20/16,"Creating a Digital Learning Pilot Project: the goal of this program is to provide equality and access to high quality digital learning solutions for all educational stakeholders. This program will provide educators with access to high quality digital learning content and curriculum development tools - particularly using free OER, they can supplement and overcome their reliance on costly and outdated text books.",Kessinger,K-12,yes,no2016,West Virginia,Legislation,SB 671,,http://www.wvlegislature.gov/Bill_Text_HTML/2016_SESSIONS/RS/Bills/SB671%20intr.htm,Introduced and referred to Education Committee - 2/22/16,"Creating a Digital Learning Pilot Project: the goal of this program is to provide equality and access to high quality digital learning solutions for all educational stakeholders. This program will provide educators with access to high quality digital learning content and curriculum development tools - particularly using free OER, they can supplement and overcome their reliance on costly and outdated text books.",Carmichael,K-12,yes,no2015,Arkansas,Legislation,SB 265,,http://www.arkleg.state.ar.us/assembly/2015/2015R/Pages/BillInformation.aspx?measureno=sb265,Signed and Enacted (Act 306),Act 306: This bill creates the University of Arkansas eVersity (an entirely online institution of higher education). This bill requires that open educational resources be utilized to support course delivery to students,Eddie Cheatham,Higher Ed,yes,yes2015,California,Legislation,AB 798,,http://www.legislature.ca.gov/cgi-bin/port-postquery?bill_number=ab_798&sess=CUR&house=B&author=bonilla_%3Cbonilla%3E,Signed by the Governor and Enacted,"College Textbook Affordability Act of 2015: The purpose of this bill is to reduce textbook costs for college students and encourage faculty to accelerate the adoption of lower cost, high-quality open educational resources. This bill creates the Open Educational Resources Adoption Incentive Fund to provide incentives and reward campus, staff, and faculty efforts to accelerate the adoption of open educational resources",Susan Bonilla,Higher Ed,yes,yes2015,Connecticut,Legislation,HB 6117,,https://www.cga.ct.gov/asp/cgabillstatus/cgabillstatus.asp?selBillType=Bill&which_year=2015&bill_num=6117,Signed and Enacted (Special Act 15-18),"Special Act 15-18 An Act Concerning the Use of Digital Open-Source Textbooks in Higher Education: This bill establishes an open-source textbook pilot program to assess the use of high-quality digital open-source textbooks and to promote the use of those textbooks. The report shall include an analysis of the cost savings to students for 		courses using an open-source textbook instead of a  traditional college-level textbook and any potential barriers to the effective use of open-source textbooks by students and faculty. This establishes a task force to study best practices re: open educational resources","Gregg Haddad, Mae Flexer ",Higher Ed,yes,yes2015,Florida,Legislation,SB 938,,http://www.flsenate.gov/Session/Bill/2015/0938/BillText/__/PDF,Died on 5/1/15 in Appropriations Subcommittee on Education,"An Act Relating to Postsecondary Education Affordability: This bill requires the Board of Governors and State Board of Education to continue to ensure college affordability, which includes strategies and initiatives to reduce the cost of higher education - these strategies must include consideration of the cost of textbooks and instructional materials - this includes expanding the use of open-access textbooks and instructional materials",Anitere Flores,Higher Ed,yes,no2015,Florida,Legislation,SB 948,,http://www.flsenate.gov/Session/Bill/2015/0948/BillText/c2/PDF,Died on Calendar 5/1/15,"An Act Relating to Education: This bill requires the Board of Governors and State Board of Education to continue to ensure college affordability, which includes strategies and initiatives to reduce the cost of higher education - these strategies must include consideration of the cost of textbooks and instructional materials - this includes expanding the use of open-access textbooks and instructional materials",Don Gaetz,Higher Ed,yes,no2015,Maine,Legislation,LD 1207,,http://legislature.maine.gov/LawMakerWeb/summary.asp?ID=280055974,Dead,"Resolve to Implement an Online Professional Development Platform for Teachers and Educators: This bill requires the Dept of Education to develop a plan to implement an online professional development platform for teachers and educators. The research and analysis conducted by the department before implementing this platform, require the department to examine online professional development platforms for teachers that include links to open-source educational resources ",Brian Hubbell,K-12,yes,no2015,Maine,Legislation,LD 391,,http://legislature.maine.gov/LawMakerWeb/summary.asp?ID=280054712,Dead,"Resolve to Create a State Run Virtual Academy Providing Maine Students with Access to Online Learning through their  Existing School Districts: This bill creates a group that is required to develop plans to establish online and digital learning opportunities, which may include a state-administered virtual academy and a state-administered digital learning exchange, that provide all public schools in the State access to online instruction, online courses, and digital learning resources for their students. The group must ensure that any digital learning exchange provides expanded digital learning opportunities to all Maine students and establishes a clearinghouse of open educational resources available to all educators, parents, and students",Brian Hubbell,K-12,yes,no2015,Massachusetts,Legislation,H 1076,,https://malegislature.gov/Bills/189/House/H1076,Referred to Committee on Education (H); Senate Concurred; Hearing scheduled for 6/3; Continued to 2016; Died,"A Resolve Establishing a Special Commission Relative to Reducing the Costs Associated with the Purchase of College Textbooks: This bill establishes a special commission established to study the college textbook industry. The information this commission shall review includes offering a choice of digital texts, and exploring the effective use of E-textbooks, amonst others. ** PLEASE NOTE: This bill does not specifically mention open educational resources",Walter Timilty,Higher Ed,no,no2015,Massachusetts,Legislation,S 325,,https://malegislature.gov/Bills/189/Senate/S325,Referred to Committee on Education (S); Hearing scheduled for 6/11; Continued to 2016; Died,"An Act Establishing a Special Commission relative to Digital Textbooks: This bill creates a commission to study and report on how to maximize the use of digital and open textbooks for grades K-12 and public colleges and universities. The commission must prepare a report to be submitted to the General Court by January 31, 2016",Mark Pacheco,Both,yes,no